{
  "archivedAt": "2026-09-24T18:25:07.650Z",
  "cutoff": "2026-09-24T18:25:07.649Z",
  "tasks": {
    "HISTORICAL-CANCELLED": {
      "id": "HISTORICAL-CANCELLED",
      "title": "Archived work survives upgrade",
      "status": "cancelled",
      "priority": 0,
      "baseSha": "a32880c7c09828e6ac4b621e9085ba4a7ce4a467",
      "expectedPaths": [
        "src/cancelled.ts"
      ],
      "actualPaths": [],
      "dependsOn": [],
      "commits": [],
      "warnings": [],
      "validations": [],
      "createdAt": "2026-09-24T18:25:07.641Z",
      "updatedAt": "2026-09-24T18:25:07.646Z"
    }
  },
  "batches": {}
}
